"5/4/23 12:32","EPA/ORD","Minnesota","Environmental Science","Joel Hoffman, Katie Williams, Samantha Rumschlag","11/1/2023","https://twitter.com/rumschsl/status/1654197993648668672?s=20","5/4/23 12:33","The Great Lakes Ecology and Toxicology Division of the U.S. Environmental Protection Agency (EPA) in Duluth, MN will soon be advertising two related Post-Doctoral Research positions focused on changes to human well-being following environmental restoration in the Great Lakes Areas of Concern (AOC). 
The first position will focus on mapping and measuring changes to ecosystem services and associated benefits from Great Lakes coastal ecosystem restoration efforts. This research will include measuring how benefits change due to climate change, particularly future change in lake levels. The goal of this project is to forecast how changes in ecosystem services could influence human communities within neighborhoods and urban areas. Ideal candidates could have experience in one or more of the following fields: ecology, biology, environmental science, epidemiology, public health, geography, environmental economics, or a related field.
The second position will focus on community resources and capacities. This project intends to use social science case study methodologies to better understand community values, decisions, abilities, and actions in relation to environmental concerns. Ideal candidates could have experience in one or more of the following fields: geography, environmental studies, anthropology, sociology, or a related field.
Work from both of these postdoctoral positions will support ongoing remediation and restoration projects led by EPA Great Lakes National Program Office. The postdocs will join an interdisciplinary team of researchers including social scientists and ecologists focused on translational ecology, an approach in which scientists, stakeholders, and decision makers together develop solutions that address sociological, ecological, and political contexts of environmental problems. The PI’s leading this work include Joel Hoffman (hoffman.joel@epa.gov), Katie Williams (williams.kathleen@epa.gov), and Samantha Rumschlag (rusmchlag.samantha@epa.gov). Interested candidates should be in touch via email ahead of the job posting to express interest. The job posting will occur towards the end of May via Zintellect (https://www.zintellect.com/), where candidates can apply. This position description serves as a tool for recruiting ahead of the job posting. Anticipated applications materials include a cover letter and CV/resume. Start dates are flexible but are expected Fall 2023.
",NA,NA,NA,NA,NA,NA,NA,NA,NA,NA,NA,NA,NA,NA,NA,NA,NA,NA,NA,NA,NA,NA,NA,NA,NA,NA,NA,NA,NA,NA,NA,NA,NA,NA,NA,NA,NA,NA,NA,NA,NA,NA,NA,NA,NA,NA,NA,NA,NA,NA,NA,NA,NA,NA,NA,NA,NA,NA,NA,NA,NA,NA,NA,NA,NA,NA,NA,NA,NA,NA,NA,NA,NA,NA,NA,NA,NA,NA,NA,NA,NA,NA,NA,NA,NA,NA,NA,NA,NA,NA,NA,NA,NA,NA,NA,NA,NA
"4/25/23 14:59","USDA-ARS Tropical Pest Genetics and Molecular Biology","Hawaii","Insect genomics, insect pests of tropical agriculture, tephritid fruit flies","Sheina Sim","7/21/2023","https://www.zintellect.com/Opportunity/Details/USDA-ARS-PW-2023-0061","4/25/23 14:59","USDA-ARS in Hilo, Hawaii seeking postdoctoral research fellow in chromosomal evolution and diversity in pest fruit flies.
 
The Tropical Pest Genetics and Molecular Biology Research Unit is seeking a highly motivated individual to use genomic tools to investigate sex chromosomes and large structural variation in Tephritidae to contribute to foundational and applied research that supports fruit fly pest management programs in the United States.
 
In this position, the incumbent will investigate genomic structure and characterization of sex chromosome structure and structural variants with applications to species and strain identification and insect diagnostics. The ideal candidate for this position will have a Ph.D. in biology, genetics, bioinformatics or a related field, with a strong background in genomics and molecular biology. Experience working on a command-line interface is required, experience working with insects, particularly tephritid fruit flies, is a plus. Candidates willing to relocate to Hilo, HI are preferred, but remote applicants who are a great fit will also be considered. Starting salary is $71,877 with health benefits and a negotiable relocation allowance. As a postdoctoral fellow at the USDA Agricultural Research Service (ARS), you have access to several high-performance computing clusters, training opportunities, and a large and active network of postdoctoral research fellows as your peers.
 
About us:
The USDA Agricultural Research Service (ARS) represents the research arm of the USDA and has about 100 research centers across the United States. The Pacific Basin Agricultural Research Center is located on the east side of the Big Island (Hawaii Island), in the town of Hilo which has a population of about 50,000. Our in-house multimillion dollar genomics facility has a suite of state-of-the-art instrumentation, with the capacity for high-accuracy short-read sequencing, high-fidelity long-read sequencing, and ultra-long read sequencing, as well as supporting laboratory equipment such as automated liquid handling devices, automated nucleic acid isolation devices, and molecular diagnostics methods.
 
To apply, please send your CV, cover letter, and most recent peer-reviewed publication to sheina.sim@usda.gov.",NA,NA,NA,NA,NA,NA,NA,NA,NA,NA,NA,NA,NA,NA,NA,NA,NA,NA,NA,NA,NA,NA,NA,NA,NA,NA,NA,NA,NA,NA,NA,NA,NA,NA,NA,NA,NA,NA,NA,NA,NA,NA,NA,NA,NA,NA,NA,NA,NA,NA,NA,NA,NA,NA,NA,NA,NA,NA,NA,NA,NA,NA,NA,NA,NA,NA,NA,NA,NA,NA,NA,NA,NA,NA,NA,NA,NA,NA,NA,NA,NA,NA,NA,NA,NA,NA,NA,NA,NA,NA,NA,NA,NA,NA,NA,NA,NA
